headwordregularized	letter	definition	author	authorregularized	title	titleregularized	book	passage	citation	lengthcit	lengthdef	headwordcount	headword
REDIRE	R		Vergilius	Vergilius	Georg.	Georgics	2	401	redit agricolis labor actus in orbem.	37		3	
RURSUS	R	significat item	Vergilius	Vergilius	Aen.	Aeneid	2	655	mrsus in arma feror.	20	15	1	
RURSUS	R	retro.	Vergilius	Vergilius	Georg.	Georgics	3	138	mrsus cura patrum cadere.	25	6	3	Rursus
RUMOR	R	favor, auxiliatio.	Vergilius	Vergilius		Aeneid	8	90	ergo iter inceptum peragunt rimiore secundo;  hoc est: prospero favore et auxilio fluminis.	91	18	5	Rumor
SUBLATUM	S	susceptum.	Vergilius	Vergilius		Aeneid	9	202	Troiaeque labores sublatum erudiit.	35	10	1	SVBLATVM
SUBLATUM	S	dicimus remotum.	Vergilius	Vergilius		Aeneid	12	25	sine me haec baut mollia fatu sublatis aperire dolis.	53	16	8	Sublatum
SUBLATUM	S	erectum.	Vergilius	Vergilius		Aeneid	5	642	sublataque procul dextra conixa coruscat.	41	8	8	Rigidum
SUFFICIT	S	significat consuetudine sat est.	Vergilius	Vergilius	Aen.	Aeneid	12	738	idque diu, dum terga dabant palantia Teucri, suffecit.	54	32	4	svFFiciT
SUFFICIT	S	subministrat.	Vergilius	Vergilius	Aen.	Aeneid	2	617	ipse pater Danais animos viresque secundas sufficit.	52	13	4	Sufficit
SUFFICIT	S	durat.	Vergilius	Vergilius		Aeneid	5	21	nec nos obniti contra nec tendere tantum sufficimus.	52	6	4	Sufficit
SUFFICIT	S		et	Vergilius		Aeneid	9	810	nec sufficit iiinbo ictibus.	28		4	
SUSPENSUM	S		Vergilius	Vergilius		Aeneid	5	489	quo tendant ferrum, malo suspendit ab alto.	43		4	
SUSPENSUM	S	sollicitum.	Vergilius	Vergilius	Aen.	Aeneid	2	114	suspensi Eurypylum scitatum oracula Phoebi mittimus.	52	11	4	Suspensum
SPECIES	S	factum, spectaculmn.	Vergilius	Vergilius	Aen.	Aeneid	2	407	non tulit hanc speciem furiata mente Coroebus.	46	20	4	Species
SEGNE	S	dicitur tardum.	Vergilius	Vergilius	Georg.	Georgics	3	42	en age, segnes  rumpe moras.	28	15	2	SEGNE
SEGNE	S	dissimile.	Vergilius	Vergilius	Aen.	Aeneid	4	149	haut illo segnior ibat Aeneas.	30	10	2	SEGNE
SALTUS	S	consuetudine a saliendo dicitur.	Vergilius	Vergilius		Aeneid	9	815	tum demum praeceps saltu sese omnibus armis in fluvium dedit.	61	32	2	SALTVS
SALTUS	S	campi spatium.	Vergilius	Vergilius	Georg.	Georgics	3	143	saltibus in vacuis pascunt et plena secundum flumina.	53	14	2	Saltus
SUBIECERE	S	est subtus iaceresubponere.	Vergilius	Vergilius	Georg.	Georgics	4	303	et ramea costis subiciunt fragmenta.	36	27	6	svBiECERE
SUBIECERE	S		et	Vergilius		Aeneid	11	812	caudamque remulcens  subiecit pavitantem utero.	47		6	
SUBIECERE	S	susum iacere; excrescere.	Vergilius	Vergilius	in Bucolicis	Bucolici	10	74	quantum vere novo viridis se subicit alnus.	43	25	6	Subiecere
SUBIECERE	S		et	Vergilius	in Georgicon	Georgics	4	385	ter flamma ad summum tecti subiecta reluxit.	44		6	
SUBIECERE	S		et	Vergilius		Aeneid	12	287	aut corpora saltu subiciunt in equos.	37		6	
SERVARE	S	liberare.	Vergilius	Vergilius	Aen.	Aeneid	3	209	servatum ex undis Strophadum me litora primum accipiunt.	56	9	10	Excludere
SERVARE	S	dicitur custodire, tueri.	Vergilius	Vergilius	Aen.	Aeneid	2	702	servate domum, servate nepotem!	31	25	10	Servare
SERVARE	S		et	Vergilius		Aeneid	7	52	sola domum et tantas servabat filia sedes.	42		10	
SERVARE	S		Vergilius	Vergilius	in Georgicon	Georgics	1	335	quod superest, caeli menses et sidera serva.	44		10	
SERVARE	S	inhabitarepossidere.	Vergilius	Vergilius	Georg.	Georgics	4	383;	centum quae silvas, centum quae flumina servant.	48	20	10	Servare
SERVARE	S		et	Vergilius	Georg	Georgics	4	458	inmanem ante pedes bydrummoritura puella servantem ripas.	57		10	
SERVARE	S	tenere.	Vergilius	Vergilius		Aeneid	7	179	curvam servans sub imagine falcem.	34	7	10	Haurire
SUPREMUM	S	significat extremum.	Vergilius	Vergilius		Aeneid	11	61	qui supremum comitentur honorem.	32	20	1	SVPREMVM
SUPREMUM	S	susum, altum.	Vergilius	Vergilius	Georg.	Georgics	4	460	clamore supremos inplerunt montis.	34	13	3	Supremum
SAEVUM	S	iratum.	Vergilius	Vergilius	Aen.	Aeneid	1	458	et saevum ambobus AcbiUen.	26	7	8	SAEVVM
SAEVUM	S	dicitur inmite.	Vergilius	Vergilius	Aen.	Aeneid	1	4	saevae memorem lunonis ob iram.	31	15	8	Saevum
SAEVUM	S	forte.	Vergilius	Vergilius	Aen.	Aeneid	1	99	saevus ubi Aeacidae telo iacet Hector.	38	6	8	Acre
SAEVUM	S	potens.	Vergilius	Vergilius	Aen.	Aeneid	1	138	non illi imperium pelagi saevumque tridentem,  sed mihi sorte datum.	68	7	8	Saevum
SAEVUM	S	durum.	Vergilius	Vergilius		Aeneid	5	270	cum saevo e scopulo multa vix arte revulsus.	44	6	8	Rigidum
SUPERARE	S		Vergilius	Vergilius	in Bucolicis	Bucolici	5	9	quid si idem certet Phoebum superare canendo?	45		8	
PERARE	P	abundare.	Vergilius	Vergilius	Georg.	Georgics	1	189	si superant fetus, pariter frumenta sequentur.	46	9	1	perare
SUPERARE	S	vivere, superesse.	Vergilius	Vergilius	Aen.	Aeneid	3	339	quid puer Ascanius? superatne et vescitur aura?	47	18	8	Superare
SUPERARE	S		et	Vergilius	Aen.	Aeneid	2	642	satis una superque vidimus excidia et captae superavinius urbi.	63		8	
SUPERARE	S	superesse.	Vergilius	Vergilius	Georg.	Georgics	3	63	praeterea superat gregibus cum laeta iuventus.	46	10	8	Superare
SUPERARE	S	ascendere.	Vergilius	Vergilius	Georg.	Georgics	3	270	superant montis et flumina tranant.	35	10	8	Evadere
SUPERARE	S		et	Vergilius	(Georg.	Georgics	3	317	gi-avido superant vix ubere limen.	34		8	
SUPERARE	S	occidere.	Vergilius	Vergilius	Aen.	Aeneid	1	350	clam ferro incautum superat.	28	9	8	Cadere
STRATUM	S	significat iacens.	Vergilius	Vergilius	Georg.	Georgics	4	432	sternunt se somno divorsae in litore phocae.	44	18	7	STRATVM
STRATUM	S	deiectum.	Vergilius	Vergilius		Aeneid	10	730	stemitur infelix Acron.	23	9	7	Stratum
STRATUM	S		et	Vergilius	in Bucolicis	Bucolici	7	54	trata iacent passim sua quaeque sub arbore poma.	48		7	
STRATUM	S	, placatum, lenitum.	Vergilius	Vergilius	in Bucolicis	Bucolici	9	57	et omne tibi stratum silet aequor.	34	20	7	Stratum
STRATUM	S	tectum	Vergilius	Vergilius	Georgicon	Georgics	3	297	et multa duram stipula felicumque maniplis stemere subter.	58	6	7	
STRATUM	S		et	Vergilius	Aen.	Aeneid	9	666	stemitur omne solum telis.	26		7	
STRATUM	S	conpositum, stmctum.	Vergilius	Vergilius	Aen.	Aeneid	1	422	miratur portas strepitumque et strata viarum.	45	20	7	Stratum
SECUNDUM	S	iuxta.	Vergilius	Vergilius	Georg.	Georgics	3	143	saltibus in vacuis pascunt et plena secundum flumina.	53	6	6	Propter
SECUNDUM	S	prosperum.	Vergilius	Vergilius		Aeneid	10	502	et servare modum, rebus sublata secundis.	41	10	6	Secundum
SECUNDUM	S	lene vel placidum.	Vergilius	Vergilius	Georg.	Georgics	3	447	mersusque secundo defluit amni.	31	18	6	Secundum
SUBMISSUM	S		Vergilius	Vergilius	Aen.	Aeneid	3	93	submissi petimus terram et vox fertur.	38		2	
SUBMITTERE	S	admittere.	Vergilius	Vergilius	in Bucolicis	Bucolici	1	45	pascite, ut ante, bovis, pueri, et submittite tauros.	53	10	3	Submittere
SUBMITTERE	S		idem	Vergilius	Georg.	Georgics	3	73	tu modo quos in spem statues submittere gentis.	47		3	
SEVERUM	S		Vergilius	Vergilius		Aeneid	8	638	Romulidis Tatioque seni Curibusque severis.	43		7	
SEVERUM	S		Vergilius	Vergilius		Aeneid	7	713	qui Tetricae horrentis rupes montemque Severum.	47		7	
SEVERUM	S	saevum, inplacidum, vitabile.	Vergilius	Vergilius	Georg.	Georgics	3	37	Invidia infelix Furias amnemque severum Cocyti metuet.	54	29	7	Severum
SOLVERE	S	ususignificat enodare.	Vergilius	Vergilius		Aeneid	7	403	solvite crinalis vittas, capite orgia mecum.	44	22	6	Solvere
SOLVERE	S	dimittere.	Vergilius	Vergilius	Georgicon	Georgics	3	64	solve mares, mitte in venerem pecuaria primus.	46	10	6	Solvere
SOLVERE	S	a curis liberum esse.	Vergilius	Vergilius	Georg.	Georgics	2	386	risuque soluto.	15	21	2	Solvi
SOLVERE	S		idem	Vergilius	Aen.	Aeneid	1	562	solvite corde metum, Teucri.	28		2	
SOLVERE	S	contempnere , despicere.	Vergilius	Vergilius	Aen.	Aeneid	4	55	solvitque pudorem.	18	24	6	Solvere
SOLVERE	S	excipere.	Vergilius	Vergilius		Aeneid	10	(lll	nec populos solvo.	18	9	6	Solvere
SUPERBUM	S	adrogans, traculentum , asperum.	Vergilius	Vergilius	Aen.	Aeneid	3	326	stirpis AchiUeae fastus iuvenemque superbum.	44	32	2	svPERBVM
SUPERBUM	S		idem	Vergilius		Aeneid	10	514	te, Turne, superbum caede nova quaerens.	40		2	
SUPERBUM	S	vitabile.	Vergilius	Vergilius		Aeneid	8	196	foribusque adfixa superbis ora virum tristi pendebant paUida tabo.	66	9	5	Obscenum
SUPERBUM	S	elatum, altum.	Vergilius	Vergilius	Georg.	Georgics	3	117	et gressus glomerare superbos.	30	14	5	Superbum
SUPERBUM	S		idem	Vergilius		Aeneid	7	630	Atina potens Tiburque superbum.	31		5	
SUPERBUM	S	ornatum	Vergilius	Vergilius	Aen.	Aeneid	2	504	barbarico postes auro spoliisque superbi procubuere.	52	7	5	
SUPERBUM	S	opulentum.	Vergilius	Vergilius		Aeneid	9	324	simul ense superbum Rhamnetem adgreditur, qui forte tapetibus altis  extructus.	79	10	5	Superbum
SUPERBUM	S	iniquo.	Vergilius	Vergilius		Aeneid	8	118	quos illi bello profugos egere superbo.	39	7	1	Superbo
STARE	S	consistere omnium consensu dicitur.	Vergilius	Vergilius	Georg.	Georgics	3	84	stare loco nescit.	18	35	7	STARE
STARE	S		Vergilius	Vergilius	Aen.	Aeneid	12	407	iam pulvere caelum stare videt.	31		7	
STATIM	S		Vergilius	Vergilius	in Bucolicis	Bucolici	7	53	stant et iuniperi et castaneae hirsutae.	40		10	
SPISSUM	S	densum dicimus.	Vergilius	Vergilius	Georg.	Georgics	2	234	sin in sua posse negabunt ire loca et scrobibus superabit terra repletis, spissus ager.	87	15	12	SPissvM
SUPERSTITES	S		Vergilius	Vergilius		Aeneid	10	47	liceat superesse nepotem.	25		4	
SICCUM	S	dicitur aridum et sine umore.	Vergilius	Vergilius		Aeneid	5	180	summa petit scopuli siccaque in rupe resedit.	45	29	7	siccvM
SEGES	S	est frumenti fructus.	Vergilius	Vergilius	Aen.	Aeneid	2	304	in segetem veluti cum flamma fm-entibus austris.	48	21	1	SEGES
ETIAM	E	ipsam terram dicimus.	Vergilius	Vergilius	Georgicon	Georgics	4	129	nec pecori opportuna seges nec commoda Baccho.	46	21	7	etiam
ETIAM	E		et	Vergilius	Aen.	Aeneid	3	142	arebant herbae et victum seges aegra negabat.	45		7	
SUMERE	S	est acciperetollere.	Vergilius	Vergilius		Aeneid	5	533	sume, pater.	12	20	14	SVMERE
SUFFERRE	S	est sustinere.	Vergilius	Vergilius	Aen.	Aeneid	2	491	nec claustra nec ipsi custodes sufferre valent.	47	14	6	SVFFERRE
SURGERE	S	crescere, augeri.	Vergilius	Vergilius	Georg.	Georgics	1	161	quis sine nec potuere seri nec surgere messis.	46	17	5	SVRGERE
SURGERE	S		idem	Vergilius	Aen.	Aeneid	4	274	Ascanium surgentem et spes heredis luli respice.	48		5	
SURGERE	S		Vergilius	Vergilius		Aeneid	8	68	surgit et aetherii spectans orientia solis  lumina.	51		5	
SACRUM	S	est sacratum vel religiosum.	Vergilius	Vergilius		Aeneid	6	484	Cererique sacrum Polyboeten.	28	28	10	SACRVM
SACRUM	S		et	Vergilius		Aeneid	7	247	sceptrumque sacerque tiaras.	28		10	
SACRUM	S		Vergilius	Vergilius	Aen.	Aeneid	3	57	auri sacra fames.	17		10	
SAUCII	S		Vergilius	Vergilius	Aen.	Aeneid	2	223	qualis mugitus, fugit cum saucius aram taurus.	46		6	
SAUCII	S		et	Vergilius		Aeneid	7	500	saucius at quadrupes nota intra tecta refugit.	46		6	
SUPPLICIUM	S	dicebatur damnatio vel poena.	Vergilius	Vergilius	Aen.	Aeneid	4	382	mediis, siquid pia numina possunt, supplicia hausurum scopulis.	63	29	1	svppLiciVM
SPERNERE	S	fastidire.	Vergilius	Vergilius	Aen.	Aeneid	4	677	comitenme sororem sprevisti moriens?	36	10	3	SPERNERE
SUBDUCERE	S		Vergilius	Vergilius	in Bucolicis	Bucolici	3	6	et sucus pecori et lac subducitur agnis.	40		11	
SUBDUCERE	S		Vergilius	Vergilius	in Bucolicis	Bucolici	9	7	qua se subducere colles incipiunt.	34		11	
SUSPICERE	S	[est] susum aspicere.	Vergilius	Vergilius		Aeneid	1	(Aen., 438	et fastigia suspicit urbis.	27	21	5	svspiCERE
SUSPICERE	S		Vergilius	Vergilius	Aen.	Aeneid	2	36	suspectaque dona praecipitare iubet.	36		5	
SUBIGERE	S	acuere.	Vergilius	Vergilius		Aeneid	7	627	subiguntque in cote secures.	28	7	14	SVBIGERE
SUBIGERE	S	est superare et sub  dicione habere.	Vergilius	Vergilius	Aen.	Aeneid	1	266	ternaque transierint Rutulis hiberna subactis.	46	36	14	Subigere
SUBIGERE	S	mollire vel exercere.	Vergilius	Vergilius	Georg.	Georgics	2	50	aut scrobibus mandet mutata subactis.	37	21	14	Subigere
SUBIGERE	S	cogere.	Vergilius	Vergilius	Georg.	Georgics	3	217	et saepe superbos  cornibus inter se subigit decernere amantis.	63	7	14	Subigere
SUBIGERE	S		et	Vergilius		Aeneid	6	567	castigatque auditque dolos subigitque fateri.	45		14	
SUMMUM	S	significat quod omnibus sit altius.	Vergilius	Vergilius	Aen.	Aeneid	4	168	summoque ulularunt vertice nymphae.	35	35	2	SVMMVM
SUMMUM	S		idem	Vergilius		Aeneid	12	492	apicem tamen incita summum hasta tulit summasque excussit vertice cristas.	74		2	
SUMMUM	S	extremum.	Vergilius	Vergilius	Aen.	Aeneid	2	324	venit summa dies et ineluctabile tempus Dardaniae.	50	9	6	Summum
SUMMUM	S	gloriosum, laudabile.	Vergilius	Vergilius		Aeneid	9	199	mene igitur sociumsummis adiungere rebus,  Nise, fugis?	55	21	6	Summum
SPECTARE	S	est videre.	Vergilius	Vergilius	Georg.	Georgics	1	158	heu! magnum alterius frustra spectabis acervum.	47	11	12	Spectare
SPECTARE	S		Vergilius	Vergilius		Aeneid	12	15	sedeant spectentque Latini.	27		12	
SPECTARE	S		Vergilius	Vergilius		Aeneid	8	150	sunt nobis fortia bello pectora, sunt animi et rebus spectata iuventus.	71		12	
STRINGERE	S	percutere.	Vergilius	Vergilius	Aen.	Aeneid	9	294	atque animum patriae strinxit pietatis imago.	45	10	7	ADMONERE
STRINGERE	S	nudare vel exerere.	Vergilius	Vergilius	Aen.	Aeneid	10	577	strictum rotat acer Lucagus ensem.	34	19	7	Stringere
STRINGERE	S	rarefacereexcidere.	Vergilius	Vergilius	in Bucolicis	Bucolici	9	60	hic ubi densas agricolae stringunt frondes.	43	19	7	Stringere
STRINGERE	S		et	Vergilius	Georg.	Georgics	2	368	tunc stringe comas, tunc brachia tonde.	39		7	
STRINGERE	S	radere, celeriter praeterii-e.	Vergilius	Vergilius		Aeneid	8	62	ego smn, pleno quem flumine cernis stiingentem ripas.	53	30	7	Stringere
STRINGERE	S	vulnerare.	Vergilius	Vergilius		Aeneid	9	576	bunc primo levis asta Themillae strinxerat.	43	10	7	Stringere
SUCCEDERE	S	dicituT In alterius locum venire.	Vergilius	Vergilius		Aeneid	10	439	interea soror abna monet succedere Lauso Turnum.	48	33	4	svccEDERE
SUCCEDERE	S	ingredi.	Vergilius	Vergilius		Aeneid	8	123	et nostris succede penatibus, hospes.	37	8	4	Succedere
SUBIT	S	in memoriam reducitur.	Vergilius	Vergilius	Aen.	Aeneid	2	562; 652	subiit deserta Creusa Ascaniusque omnisque domus.	49	22	1	SVBIT
SUBIRE	S	significat ingredi.	Vergilius	Vergilius		Aeneid	8	362	haec, inquit, limina victor  Alcides subiit.	44	19	7	Subire
SUBIRE	S	subdi, subponi.	Vergilius	Vergilius		Aeneid	10	798	Aeneae subiit mucronem ipsumque morando sustinuit.	50	15	7	Subire
SUBIRE	S	nasci, subcrescere.	Vergilius	Vergilius	Georg.	Georgics	1	180	ne subeant herbae neu pulvere victa fatiscat.	45	19	7	Subire
SUBIRE	S	adgredi, succedere.	Vergilius	Vergilius		Aeneid	9	344	Fadumque Herbesumque subit.	27	19	7	Subire
SECARE	S	dicitur excidere.	Vergilius	Vergilius		Aeneid	9	102	qualis Nereia Doto  et Galatea secant spumantem pectore pontum.	63	17	3	SECARE
SECARE	S		Vergilius	Vergilius		Aeneid	10	107	quae cuique est fortuna hodie, quam quisque secat spem.	55		3	
SQUALIDUM	S	sicuti plerumque, dicitur sordidum.	Vergilius	Vergilius	Aen.	Aeneid	2	277	squalentem barbam et concretos sanguine crinis.	47	35	1	SQVALiDVM
SQUALIDUM	S	fulgens.	Vergilius	Vergilius		Aeneid	10	314	per tunicam squalentem auro latus aurit apertum.	48	8	1	Squalidum
SEDET	S	significationem habet claram	Vergilius	Vergilius		Aeneid	9	4	Turnus sacrata valle sedebat.	29	28	2	
SEDET	S	placet.	Vergilius	Vergilius		Aeneid	5	418	idque pio sedet Aeneae, probat auctor Acestes.	46	7	2	SEDET
SUSTULIT	S	est susum tulit, erexit.	Vergilius	Vergilius	Aen.	Aeneid	2	153	sustulit exutas vinclis ad sidera palmas,	41	24	1	svsTVLiT
SUSTULIT	S		Vergilius	Vergilius	Georg.	Georgics	1	76	sustuleris fragilis calamos silvamque sonantem.	47		2	
SPARGERE	S	significat destillarc vel guttatim fundere.	Vergilius	Vergilius		Aeneid	12	339	spargit rapida ungula rores sanguineos.	39	43	6	Spargere
SPARGERE	S		idem	Vergilius	Aen.	Aeneid	4	486	spargens umidamella soporiferamque papaver.	43		6	
SPARGERE	S		Vergilius	Vergilius	Aen.	Aeneid	3	534	spumant aspargine cautes.	25		6	
SPARGERE	S	separare.	Vergilius	Vergilius	Georg.	Georgics	4	522	diversum latos iuvenem sparsere per agros.	42	9	6	DiSTRAHERE
SPARGERE	S	inplere.	Vergilius	Vergilius	Aen.	Aeneid	9	459	et iam prima novo spargebat lumine terras.	42	8	6	Spargere
SIGNARE	S	inprimere.	Vergilius	Vergilius	Georg.	Georgics	3	171	et summo vestigia pulvere signent.	34	10	3	Signare
SOLIDI	S	significatio manifesta est.	Vergilius	Vergilius		Aeneid	6	552	solidoque adamante columnae.	28	27	1	soLiDi
SUBNIXUM	S	subditum.	Vergilius	Vergilius	Aen.	Aeneid	3	lib. III	iuveneinque superbum servitio enixae tulimus.	45	9	1	svBNixvM
SUBNIXUM	S		Vergilius	Vergilius	Aen.	Aeneid	4	216	Maeonia mentum mitra crinemque madentem subnixus rapto potitur.	63		2	
TANDEM	T		Vergilius	Vergilius	Aen.	Aeneid	3	278	ergo insperata tandem tellure potiti.	37		2	
TAMEN	T		Vergilius	Vergilius	in Bucolicis	Bucolici	9	62	hic haedos depone: tamen veniemus in urbem.o	45		4	
TOLLERE	T	mittere.	Vergilius	Vergilius	Aen.	Aeneid	2	222	clamores simul lioiTendos ad sidera tollit.	43	8	19	Dimittere
TOLLERE	T	transferre.	Vergilius	Vergilius	Aen.	Aeneid	2	131	unius in miseri exitium conversa tulere.	40	11	19	Mutare
TOLLERE	T	inferre.	Vergilius	Vergilius	Georg.	Georgics	3	421	so tollentemque minas et sibila coUa tumentem deice.	52	8	19	Tollere
TOLLERE	T	est elevare.	Vergilius	Vergilius	Aen.	Aeneid	1	66)			12	19	Tollere
TOLLERE	T		et	Vergilius		Aeneid	12	892	et mulcere dedit fluctus et tollere vento.	42		19	
TOLLERE	T		item	Vergilius		Aeneid	10		]:  tollit se adrectum quadrupes.	33		19	
TOLLERE	T	osten dere, erigere, extollere.	Vergilius	Vergilius	Aen.	Aeneid	1	314	cui mater media sese tuUt obvia silva.	38	31	19	Tollere
TOLLERE	T		idem	Vergilius		Aeneid	7	117	,iaborum prima tulit finem.	27		19	
TOLLERE	T	pati, sustinere.	Vergilius	Vergilius	Aen.	Aeneid	3	326	iuvenemque superbum  servitio enixae tulimus.	45	16	19	Tollere
TOLLERE	T		et	Vergilius		Aeneid	12	371	non tulit instantem Phegeus animisque frementem.	48		19	
TEMPESTAS	T	est turbo ventorum.	Vergilius	Vergilius	Georg.	Georgics	1	311	quid tempestates autumni et sidera dicam?	41	19	6	TEMPESTAS
TREPIDARE	T	metuere.	Vergilius	Vergilius		Aeneid	9	(-418	dum trepidant, it hasta Tago per tempus utrumque.	49	8	5	TREPiDARE
TREPIDARE	T		idem	Vergilius		Aeneid	2		trepident inmisso lumine Manes.	31		5	
TREPIDARE	T	festinare.	Vergilius	Vergilius		Aeneid	9	114	ne trepidate meas, Teucri, defendere navis.	43	10	5	Ardere
TREPIDARE	T		et	Vergilius	Georg.	Georgics	4	73	tunc trepidae inter se coeunt pinnisque coruscant.	50		5	
TANGERE	T	ferire, cominovere.	Vergilius	Vergilius		Aeneid	9	138	nec solos tangit Atridas iste dolor.	36	19	13	Tangere
TANGERE	T		idem	Vergilius		Aeneid	12	932	miseri te siqua parentis  tangere cura potest, oro.	51		13	
TANGERE	T		Vergilius	Vergilius		Aeneid	9	135	sat fatis Venerique datum, tetigere quod arva  fertilis Ausoniae Troes.	71		13	
TRISTE	T	crudele, inmite.	Vergilius	Vergilius	Aen.	Aeneid	3	548	illi mea tristia facta degeneremque Neoptolemum narrare memento.	64	16	19	Triste
TRISTE	T	est maestum aut infestum.	Vergilius	Vergilius	in Bucolicis	Bucolici	10	31	tristis at ille: tamen cantabitis, Arcades, inquit.	51	25	19	Triste
TRISTE	T		idem	Vergilius	Georg.	Georgics	3	278	aut unde nigerrunus Auster  nascitur et pluvio contristat frigore caelum.	73		19	
TRISTE	T		idem	Vergilius	in Bucolicis	Bucolici	3	80	triste lupus stabulis, maturis frugibus imbres.	47		19	
TRISTE	T	amarum.	Vergilius	Vergilius	Georg.	Georgics	1	75	tristisque lupini sustuleris fragilis calamos.	46	7	19	Grave
TRISTE	T	minax.	Vergilius	Vergilius	Aen.	Aeneid	2	115	isque adytis haec tristia dicta reportat.	41	6	19	Triste
TRISTE	T	nigrum.	Vergilius	Vergilius	Georg.	Georgics	3	448	aut tonsum tristi contingunt corpus amurca.	43	7	19	Triste
TRAHERE	T	pcr terram ducere.	Vergilius	Vergilius	Aen.	Aeneid	1	477	lora tenens tamen; huic cervixque trahuntur per terram.	55	18	5	TRAHERE
TARDUM	T	significat pigrum, lentum.	Vergilius	Vergilius	Georg.	Georgics	1	273	saepe oleo tardi costas agitator aselli.	40	26	3	TARDVM
TARDUM	T	diuturnum, perseverantem.	Vergilius	Vergilius	Georg.	Georgics	2	126	Media fert tristis sucos tardumque saporem.	43	25	3	Tardum
TENDERE	T	Inhabitare, tabernacula et hospitia ponere.	Vergilius	Vergilius	Aen.	Aeneid	2	2,9	hic Dolopum manus, hic saevus tendebat Achilles.	48	43	10	Tendere
TENDERE	T	est proprie laxitatem distendere et sine rugis facere.	Vergilius	Vergilius	Aen.	Aeneid	3	268	tendunt vela noti.	18	54	10	Tendere
TENDERE	T		idem	Vergilius		Aeneid	6	314	tendebantque manus ripae ulterioris amore.	42		10	
TENDERE	T	est dirigere.	Vergilius	Vergilius	Aen.	Aeneid	1	204	per tot discrimina rerum  tendimus in Latium.	45	13	10	Tendere
TENDERE	T		idem	Vergilius		Aeneid	2	405	ad caelum tendensardentia lumina.	33		10	
TENDERE	T	contendere.	Vergilius	Vergilius	Aen.	Aeneid	2	220	ille simul manibus tendit divellere nodos.	42	11	10	Tendere
TENDERE	T		idem	Vergilius		Aeneid	5	154	aequo discrimine Pistrix Centaurusque locum tendunt superare priorem.	69		10	
TURPE	S	est indecorum, informe.	Vergilius	Vergilius		Aeneid	6	276	et Metus et malesuada Fames ac turpis Egestas.	46	23	4	TVRPE
TURPE	S		idem	Vergilius	Georg.	Georgics	3	299	scabiemque ferat turpisque podagras.	36		4	
TURPE	S	grande.	Vergilius	Vergilius	Georg.	Georgics	3	51	optuma torvae forma bovis, cui turpe caput.	43	7	4	Turpe
TURPE	S		idem	Vergilius	Georg.	Georgics	4	395	et turpis pascit sub gurgite phocas.	36		4	
TENERVM	T	significat gracilentum.	Vergilius	Vergilius	Georg.	Georgics	3	Lib. III	et ros in tenera pecori gratissimus herba.	42	23	1	TENERVM
TENUE	T	vehemens.	Vergilius	Vergilius	Georg.	Georgics	2	93	enuisque lageos, emtatura pedes olim vincturaque linguam.	57	9	1	TENVE
TENUE	T	infecundum.	Vergilius	Vergilius	Georg.	Georgics	2	180	tenvis ubi argilla et dumosis calculus arvis.	45	11	7	Tenue
TENUE	T	,frigidum.	Vergilius	Vergilius	Georg.	Georgics	1	92	ne tenues pluviae rapidive potentia solis acrior.	49	10	7	Tenue
TENUE	T		idem	Vergilius		Aeneid	3		tum tenues dare rursus aquas.335	32		7	
TENUE	T		Vergilius	Vergilius		Aeneid	5	690	et tenuis Teucrum res eripe leto.	33		7	
TENUE	T		idem	Vergilius	Georg.	Georgics	1	177	ni refugis tenuisque piget cognoscere curas.	44		7	
TENET	T	sicuti est ususignificat conprebendit, detinet.	Vergilius	Vergilius	Georg.	Georgics	4	405	verum ubi correptummanibus vinclisque tenebis.	46	47	8	Tenet
TENET	T	inhabitat, possidet.	Vergilius	Vergilius	Georg.	Georgics	4	321	quae gurgitis huius  ima tenes.	31	20	8	Tenet
TENET	T	prohibet.	Vergilius	Vergilius	Georg.	Georgics	2	371	texendae saepes etiam, pecus omne tenendum.	43	9	8	Tenet
TENET	T	conpescit, subprimit.	Vergilius	Vergilius	Georg.	Georgics	4	483	tenuitque inhians tria Cerberus ora.	36	21	8	Tenet
TENET	T	tegit.	Vergilius	Vergilius	Georg.	Georgics	1	115	amnis abundans exit et obducto late tenet omnia limo.	53	6	8	Tenet
TENET	T	dirigit.	Vergilius	Vergilius	Aen.	Aeneid	1	369	sed vos qui tandem? quibus aut venistis ab oris quove tenetis iter?	67	8	8	Tenet
PREMERE	P	dicitur conmoveri, agitari.	Vergilius	Vergilius		Aeneid	11	424	cur ante tubam tremor occupat artus?	36	27	21	TREMERE
PREMERE	P	timere.	Vergilius	Vergilius	Aen.	Aeneid	2	199	hic aliud maius miseris multoque tremendum.	43	7	21	TREMERE
TRAHERE	T	consuetudine manifestam habet significantiam. [ut]	Vergilius	Vergilius	Aen.	Aeneid	2	550	altaria ad ipsa trementem traxit.	33	50	5	TRAHERE
TRAHERE	T	dare.	Vergilius	Vergilius	Aen.	Aeneid	1	508	partibus aequabat iustis aut sorte trahebat.	44	5	5	Conparare
TEMPTARE	T	est exercere.	Vergilius	Vergilius	Georg.	Georgics	3	232	et temptat sese atque irasci in cornua discit, arboris obnixus trunco.	70	13	3	Temptare
TEMPTARE	T	experiri.	Vergilius	Vergilius		Aeneid	8	143	his fretus non legatos neque prima per artem  temtamenta tui pepigi.	68	9	3	Temptare
TEMPTARE	T	adgredi.	Vergilius	Vergilius	Aen.	Aeneid	2	176	extemplo temptanda fuga canit aequora Calchas.	46	8	3	Temptare
TEMPTARE	T	petere [dare].	Vergilius	Vergilius	Aen.	Aeneid	3	145	unde laborum temptare auxilium iubeat.	38	14	1	Temtare
TAETRUM	T	dicitur inluviosum, faetidum.	Vergilius	Vergilius	Aen.	Aeneid	3	228	tunc vox taetrum dira inter odorem.	35	29	7	Taetrum
TAETRUM	T		idem	Vergilius		Aeneid	10	727	'^ lavit inproba taeter ora cruor.	34		7	
TORQUERE	T	significat inflectere.	Vergilius	Vergilius	Georg.	Georgics	2	448	Ityraeos taxi torquentur in arcus.	34	22	5	TORQVERE
TORQUERE	T	gyro celeii rotare.	Vergilius	Vergilius	Aen.	Aeneid	1	(ll6	ast illam ter fluctus ib	24	19	5	Torquere
TORQUERE	T		idem	Vergilius		Aeneid	1		torquet agens circum.			5	
TORQUERE	T	iaceremittere.	Vergilius	Vergilius		Aeneid	5	497	so in medios telum torsisti primus Achivos.	43	14	5	Torquere
TUERI	T		Vergilius	Vergilius		Aeneid	9	175; cf.164, 222	succedunt variantque vices, quod cuique tuendum est.	52		4	
TUERI	T	videre.	Vergilius	Vergilius		Aeneid	5	575	excipiunt plausu pavidosgaudentque tuentes  Dardanidae.	55	7	4	Accipere
TERGORA	T	dicuntur coria.	Vergilius	Vergilius	Aen.	Aeneid	1	211	tergora diripiunt costis.	25	15	3	TERGORA
TERGORA	T	dorsa.	Vergilius	Vergilius		Aeneid	9	763	 hinc raptas fugientibus ingerit hastas in tergum.	51	6	3	TERGORA
TERGUM	T	scutum.	Vergilius	Vergilius		Aeneid	9	412	et venit adversi in tergum Sulmonis.	36	7	2	Tergum
TERGUM	T		idem	Vergilius		Aeneid	10	718	dentibus infrendens et tergo decutit hastas.	44		2	
VOLARE	V	est avium.	Vergilius	Vergilius	Aen.	Aeneid	4	255	humilis volat aequora iuxta.	28	10	3	VOLARE
VOLARE	V		Vergilius	Vergilius		Aeneid	5	324	ecce volat calcemque terit iam calce Diores.	44		3	
VASTUM	V	est magnum.	Vergilius	Vergilius	Aen.	Aeneid	3	191	vastumque cava trabe curiimus aequor.	37	11	4	VASTVM
VASTUM	V	ingens.	Vergilius	Vergilius	Aen.	Aeneid	1	52	hic vasto rex Aeolus antro.	27	7	4	Vastum
VENTUS	V	est flatus.	Vergilius	Vergilius		Aeneid	1	66	et mulcere dedit fluctus et tollere vento.	42	11	2	VENTVS
VIRTUS	V	est fortitudo.	Vergilius	Vergilius		Aeneid	5	455	tunc pudor incendit vires et conscia virtus.	44	14	3	VIRTVS
